term,terms
cheat codes gta vice city stories psp cars drive on water,['cheat codes gta vice city stories psp cars drive on water']
can you read texts online sprint,"['can you read texts online sprint', 'how to read texts online sprint', 'can parents read texts online sprint', 'if you have sprint can you read your texts online']"
track spouse phone location,"['track spouse phone location', 'track spouse cell phone location', 'track my wifes phone location', ""track wife's cell phone location""]"
can you read your text messages through icloud,"['can you read your text messages through icloud', 'can you access your text messages through icloud', 'can someone read your text messages through icloud']"
android app to track girlfriends period,['android app to track girlfriends period']
spyro ps1 controls,"['spyro ps1 controls', 'spyro the dragon controls', 'spyro ps1 cheats', 'spyro ps1 cheats year dragon']"
fallout 3 cheats weapons list,"['fallout 3 cheats weapons list', 'fallout 3 cheats list', 'fallout 3 cheats list pc']"
keylogger software,"['keylogger software', 'keylogger software for mac', 'keylogger software download', 'keylogger software for android', 'keylogger software for iphone', 'keylogger software for windows', 'keylogger software reviews', 'keylogger software for windows 7', 'keylogger software detection', 'keylogger software for windows 10']"
catch cheating girlfriend,"['catch cheating girlfriend', 'catch cheating girlfriend app', 'catch cheating girlfriend signs', 'catch cheating girlfriend iphone', 'catch cheating girlfriend facebook', 'catch girlfriend cheating text messages', 'catch girlfriend cheating cell phone', 'catch girlfriend cheating snapchat', 'catch girlfriend cheating app free', 'guy catch girlfriend cheating']"
best family tracker app for iphone,"['best family tracker app for iphone', 'best family tracker app for iphone and android', 'best family locator app for iphone', 'best family locator app for iphone 2015', 'best family locator app for ios', 'best family locator app for android and iphone 2015', 'family tracker app for iphone and android', 'family tracker app for iphone', 'free family tracker app for iphone', 'family locator app for iphone']"
cheaters app,"['cheaters app', 'cheaters apps reviews', 'cheaters app on shark tank', 'cheaters app for android free', 'cheaters app iphone', 'cheaters app for android', 'cheaters app for iphone free', 'cheaters app free', 'cheaters application']"
family locator verizon login,"['family locator verizon login', 'family locator verizon sign in', 'verizon family locator login page', 'my verizon family locator login']"
can you read text messages through icloud,"['can you read text messages through icloud', 'can u read text messages through icloud', 'can you read someones text messages through icloud', 'can you read your text messages through icloud', 'can you read other peoples text messages through icloud', 'can you read text messages online with icloud', 'can you access old text messages through icloud', 'can you read text messages thru icloud', 'can i access text messages through icloud']"
sygic family locator pro apk,['sygic family locator pro apk']
cheat codes for gta v online ps4,"['cheat codes for gta v online ps4', 'money cheat for gta v online ps4']"
free cell phone gps tracking app for android,['free cell phone gps tracking app for android']
catch girlfriend cheating text messages,['catch girlfriend cheating text messages']
read sms on pc android,"['read sms on pc android', 'read android sms backup on pc']"
cheat codes for gta 5 ps3 all cars,"['cheat codes for gta 5 ps3 all cars', 'cheat codes for gta 5 ps3 cars', 'cheat codes for gta 5 ps3 flying cars', 'cheat codes for gta 5 ps3 repair car', 'cheat codes for gta 5 ps3 cop car']"
track your spouse visa application,['track your spouse visa application']
cheat engine for mac 10.6.8,['cheat engine for mac 10.6.8']
dirt track racing girlfriend shirts,['dirt track racing girlfriend shirts']
cheaters spy shop,"['cheaters spy shop', 'cheaters spy shop gps trackers', 'cheatersspyshop cell phone monitoring', 'cheaters spy shop free', 'cheaters spy shop app', 'cheatersspyshop catch cheating husband wife', 'cheatersspyshop reviews', 'cheatersspyshop cheaters merch', 'cheatersspyshop catch cheating', 'cheaters spy shop deleted text']"
cheating quotes for him in telugu,['cheating quotes for him in telugu']
cheaters never prosper quote,"['cheaters never prosper quote', 'cheaters never prosper quote origin', 'quotes like cheaters never prosper']"
catch cheating girlfriend app,"['catch cheating girlfriend app', 'catch girlfriend cheating app free']"
cheat sheet for word cookies,"['cheat sheet for word cookies', 'cheat sheet for word cookies game', 'cheat sheet for word cookies banana', 'cheat sheet for word cookies vanilla 17', 'cheat sheet for word cookies rose', 'cheat sheet for word cookies special level', 'cheat sheet for word cookies cinnamon', 'cheat sheet for word cookies chocolate', 'cheat sheet for word cookies red velvet', 'cheat sheet for word cookies caramel']"
read texts on computer,"['read texts on computer', 'read texts on computer android', 'read texts on computer iphone', 'read texts on computer verizon', 'read texts on computer sprint', 'read texts on computer at&t', 'read texts on computer blackberry', 'read phone texts on computer', 'read samsung texts on computer', 'read old iphone texts on computer']"
spyderco,"['spyderco', 'spyderco paramilitary 2', 'spyderco tenacious', 'spyderco sharpmaker', 'spyderco delica 4', 'spyderco manix 2', 'spyderco endura', 'spyderco paramilitary 3', 'spyderco dragonfly 2', 'spyderco dragonfly']"
cheat engine dark souls 3 infinite health,['cheat engine dark souls 3 infinite health']
keylogger for iphone 5,"['keylogger for iphone 5', 'keylogger for iphone 5 without jailbreak', 'keylogger for iphone 5 free', 'best keylogger for iphone 5', 'keylogger app for iphone 5', 'keylogger para iphone 5', 'keylogger cho iphone 5', 'keylogger para iphone 5c', 'keylogger fur iphone 5', 'keylogger per iphone 5s']"
sprint family locator review iphone,['sprint family locator review iphone']
can i track my uk spouse visa application,['can i track my uk spouse visa application']
cheat engine 6.4 for macbook pro,['cheat engine 6.4 for macbook pro']
spy kids thumb,"['spy kids thumb', 'spy kids thumb people']"
cheat sheet for poker hands,"['cheat sheet for poker hands', 'cheat sheet for poker hands printable', 'cheat sheet for poker hands order']"
cheat codes for gta v online for xbox 360,"['cheat codes for gta v online for xbox 360', 'cheat codes for grand theft auto 5 online for xbox 360']"
read sms messages on computer,"['read sms messages on computer', 'read text messages on computer', 'read text messages on computer iphone', 'read text messages on computer android', 'read text messages on computer verizon', 'read text messages on computer at&t', 'read text messages on computer t mobile', 'read text messages on computer from phone', 'sprint read text messages on computer', 'read text messages on your computer']"
best free gps tracker app for iphone,"['best free gps tracker app for iphone', 'best free gps tracking app for iphone', 'best free gps phone tracking app for iphone', 'free gps tracker app for iphone', 'free gps tracker app for iphone and android', 'free gps tracking app for iphone', 'free gps tracking software for iphone']"
best family locator app for iphone,"['best family locator app for iphone', 'best family locator app for iphone 2015', 'best family locator app for ios', 'best family locator app for android and iphone 2015', 'family locator app for iphone', 'family locator apps for iphone and android', 'sprint family locator app for iphone', 'verizon family locator app for iphone', 'sprint family locator app for iphone 5', 'free family locator app for iphone']"
cheat codes grand theft auto vice city psp jetpack,"['cheat codes grand theft auto vice city psp jetpack', 'cheat codes grand theft auto vice city psp flying cars', 'cheat codes grand theft auto vice city psp helicopter', 'cheat codes for psp grand theft auto vice city stories jetpack', 'cheat codes grand theft auto vice city stories psp tank', 'grand theft auto vice city stories jetpack cheat code', 'grand theft auto vice city psp cheat codes tank', 'grand theft auto vice city psp boat cheat code', 'grand theft auto vice city stories helicopter cheat codes for ps2']"
read text messages out loud android,"['read text messages out loud android', 'read text messages aloud android', 'android app to read text messages out loud']"
spyro the dragon ps4 remake,['spyro the dragon ps4 remake']
spyfall app,"['spyfall app', 'spyfall app rules', 'spyfall app game', 'spyfall app android', 'spyfall app store', 'spyfall app download', 'spyfall apple', 'spyfall app review', 'spyfall apple and android']"
catch cheating spouse app free,"['catch cheating spouse app free', 'catch your spouse cheating app free', 'free iphone app to catch cheating spouse']"
spy camera,"['spy camera', 'spy camera wifi', 'spy camera app', 'spy camera for cars', 'spy camera pen', 'spy camera glasses', 'spy camera charger', 'spy camera for home', 'spy camera amazon', 'spy camera detector']"
cheat engine 6.3 portable,"['cheat engine 6.3 portable', 'cheat engine 6.3 portable mega', 'cheat engine 6.3 portable descargar', 'descargar cheat engine 6.3 portable mega', 'cheat engine 6.3 cs portable', 'cheat engine 6.3 portable espanol', 'cheat engine 6.3 portable mf', 'cheat engine 6.3 full portable', 'descargar cheat engine 6.3 gratis portable']"
cheat engine 6.3 roblox hacks,['cheat engine 6.3 roblox hacks']
cheat codes for gta v online ps3,"['cheat codes for gta v online ps3', 'money cheat for gta v online ps3']"
fallout 3 console commands item codes stimpack,['fallout 3 console commands item codes stimpack']
cheaters never prosper book,['cheaters never prosper book']
cheat sheet for poker texas holdem,"['cheat sheet for poker texas holdem', 'cheat sheet for texas holdem', 'texas hold em hands cheat sheet']"
catch cheating girlfriend iphone,"['catch cheating girlfriend iphone', 'app to catch cheating girlfriend iphone']"
best free gps tracker app for android,"['best free gps tracker app for android', 'free gps tracker app for android', 'free gps tracking app for android and iphone', 'free gps tracking app for android phones', 'free gps tracking software for android', 'free gps tracking software for android phones', 'best free gps tracking android']"
cheat codes for gta vice city stories pc edition,['cheat codes for gta vice city stories pc edition']
family locator app iphone,"['family locator app iphone', 'family locator app iphone android', 'family tracking app iphone', 'family locator app ios', 'free family locator app iphone', 'best family locator app iphone', 'family locator app verizon iphone', 'sprint family locator app iphone', 'family tracking app for iphone and android', 'life360 family locator iphone app']"
family phone tracker free,"['family phone tracker free', 'family cell phone tracker free']"
spyro dawn of the dragon,"['spyro dawn of the dragon', 'spyro dawn of the dragon cheats', 'spyro dawn of the dragon ps3', 'spyro dawn of the dragon xbox 360', 'spyro dawn of the dragon ps2', 'spyro dawn of the dragon ds', 'spyro dawn of the dragon wii', 'spyro dawn of the dragon cheats wii', 'spyro dawn of the dragon ps4', 'spyro dawn of the dragon cheats ps2']"
cheat engine android without root - apkforandroids.com,['cheat engine android without root - apkforandroids.com']
cheaters spy shop gps trackers,['cheaters spy shop gps trackers']
read texts on computer at&t,['read texts on computer at&t']
read text messages online icloud,"['read text messages online icloud', 'check text messages online icloud']"
spyderco paramilitary 3,"['spyderco paramilitary 3', 'spyderco paramilitary 3 review', 'spyderco paramilitary 3 for sale', 'spyderco paramilitary 3 black blade', 'spyderco paramilitary 3 scales', 'spyderco paramilitary 3 sprint run', 'spyderco paramilitary 3 cruwear', 'spyderco paramilitary 3 camo', 'spyderco paramilitary 3 s110v', 'spyderco paramilitary 3 amazon']"
track cheating spouse app,"['track cheating spouse app', 'gps tracking cheating spouse app', 'track cheating spouse cell phone app', 'track cheating spouse cell phone free app', 'free app to track cheating spouse', 'android app to track cheating spouse']"
free download donde esta family locator.apk,[]
track my wifes cell phone location,"[""track my wife's cell phone location free"", 'track my wifes cell phone location', 'can i track my wifes cell phone location']"
cheating stories buzzfeed,['cheating stories buzzfeed']
cheat codes for gta vice city psp helicopter cheats,['cheat codes for gta vice city psp helicopter cheats']
cheat codes for gta 5 ps3 money,"['cheat codes for gta 5 ps3 money', 'cheat codes for grand theft auto 5 ps3 money', 'cheat codes for gta 5 ps3 infinite money', 'cheat codes for gta 5 ps3 free money', 'cheat codes for gta 5 ps3 unlimited money online']"
tank cheat code for gta vice city stories psp,"['tank cheat code for gta vice city stories psp', 'helicopter cheat code for gta vice city stories psp', 'cheat code boat gta vice city stories psp', 'cheat codes grand theft auto vice city stories psp tank', 'cheat code unlock helicopter gta vice city stories psp', 'cheat codes gta vice city stories psp get helicopter']"
track girlfriend period app,"['track girlfriend period app', 'android app to track girlfriends period']"
spyro dawn of the dragon ps3,"['spyro dawn of the dragon ps3', 'spyro dawn of the dragon ps3 cheats', 'spyro dawn of the dragon ps3 for sale', 'spyro dawn of the dragon ps3 ebay', 'spyro dawn of the dragon ps3 gamestop', 'spyro dawn of the dragon ps3 walkthrough', 'spyro dawn of the dragon ps3 iso', 'spyro dawn of the dragon ps3 trophies', 'spyro dawn of the dragon ps3 amazon']"
spy camera detector,"['spy camera detector', 'spy camera detector app', 'spy camera detector app for android', 'spy camera detector app for iphone', 'spy camera detector reviews', 'spy camera detector gadget', 'spy camera detector amazon', 'spy camera detector singapore', 'spy camera detector app for android free download', 'spy camera detector device']"
cheat codes for gta 5,"['cheat codes for gta 5', 'cheat codes for gta 5 ps3', 'cheat codes for gta 5 online', 'cheat codes for gta 5 pc', 'cheat codes for gta 5 ps4 money', 'cheat codes for gta 5 money', 'cheat codes for gta 5 ps3 online', 'cheat codes for gta 5 xbox 360 cars', 'cheat codes for gta 5 ps4 numbers', 'cheat codes for gta 5 cars']"
cheat codes for gta vice city psp vita,"['cheat codes for gta vice city psp vita', 'cheat codes for gta vice city ps vita']"
spyder movie review,"['spyder movie review', 'spyder movie review usa', 'spyder movie review idlebrain', 'spyder movie review twitter', 'spyder movie review and rating', 'spyder movie review behindwoods', 'spyder movie review in telugu', 'spyder movie review greatandhra', 'spyder movie review live updates']"
catch cheating spouse free app,"['catch cheating spouse free app', 'catch your spouse cheating free app', 'free iphone apps to catch cheating spouse', 'free android apps to catch cheating spouse']"
cheating definition,"['cheating definition', 'cheating definition in school', 'cheating definition marriage', 'cheating definition webster', 'cheating definition relationship', 'cheating definition bible', 'cheating definition in ipc', 'cheating definition essay', 'cheating definition oxford']"
cheaters app for android free,['cheaters app for android free']
free family locator app for iphone,"['free family locator app for iphone and android', 'free family locator app for iphone', 'best free family locator app for iphone']"
best keylogger for iphone 5,"['best keylogger for iphone 5', 'keylogger for iphone 5', 'keylogger for iphone 5 without jailbreak', 'keylogger for iphone 5 free']"
spyfall app rules,['spyfall app rules']
cheat engine 6.3 mac download,"['cheat engine 6.3 mac download', 'cheat engine 6.3 free download mac os x', 'cheat engine 6.3 mac os x download', 'cheat engine 6.3 download', 'cheat engine 6.3 download for windows 7', 'cheat engine 6.3 download for windows 8', 'cheat engine 6.3 download softonic', 'cheat engine 6.3 download filehippo', 'cheat engine 6.3 download 32 bit', 'cheat engine 6.3 download 64 bit']"
