term,terms
catch your cheating spouse iphone,"['catch your cheating spouse iphone', 'catch your cheating spouse iphone app']"
cheat engine 6.4 roblox bypass,['cheat engine 6.4 roblox bypass']
family locator pro life360,['family locator pro life360']
cheat codes band members ages,['cheat codes band members ages']
cheat engine android remote system,['cheat engine android remote system']
keylogger usb,"['keylogger usb', 'keylogger usb wifi', 'keylogger usb download', 'keylogger usb software', 'keylogger usb amazon', 'keylogger usb ebay', 'keylogger usb mac', 'keylogger usb keyboard', 'keylogger usb drive', 'keylogger usb reddit']"
track my spouse visa application,"['track my spouse visa application', 'can i track my uk spouse visa application']"
best app to catch cheating spouse iphone,"['best app to catch cheating spouse iphone', 'app to catch a cheating spouse iphone free']"
cheat sheet for poker,"['cheat sheet for poker', 'cheat sheet for poker hands', 'cheat sheet for poker texas holdem', 'cheat sheet for poker hands printable', 'cheat sheet for poker hands order', 'cheat sheet for video poker', 'cheat sheet for playing poker', 'poker cheat sheet for beginners']"
life360 family locator app free download,['life360 family locator app free download']
gps locator app for iphone and android,"['gps locator app for iphone and android', 'gps tracker app for iphone and android', 'best gps tracker app for iphone and android']"
cheating boyfriend quotes pinterest,['cheating boyfriend quotes pinterest']
descargar cheat engine 6.4 portable,"['descargar cheat engine 6.4 portable', 'descargar cheat engine 6.4 portable gratis', 'download cheat engine 6.4 portable', 'free download cheat engine 6.4 portable', 'descargar cheat engine 6.4 en espanol portable', 'descargar cheat engine 6.4 portable mega', 'descargar cheat engine 6.4 portable mf', 'descargar cheat engine 6.4 portable por mega']"
fallout 3 cheat codes xbox 360 infinite ammo,['fallout 3 cheat codes xbox 360 infinite ammo']
best free family locator app 2015,['best free family locator app 2015']
keylogger android no root,"['keylogger android no root', 'android keylogger without rooting', 'best android keylogger no root', 'free android keylogger no root', 'keylogger para android no root']"
cheat engine 6.3 mac,"['cheat engine 6.3 mac', 'cheat engine 6.3 mac download', 'cheat engine 6.3 mac os x', 'cheat engine 6.3 macbook', 'cheat engine 6.3 mac os', 'mac os x cheat engine 6.3', 'cheat engine 6.3 mac os x download', 'cheat engine 6.3 for macbook air', 'cheat engine 6.3 for macbook pro', 'roblox cheat engine 6.3 mac']"
cheat codes for gta vice city stories for xbox 360,['cheat codes for gta vice city stories for xbox 360']
cheat engine for mac os x 10.10,"['cheat engine for mac os x 10.10', 'cheat engine mac os x 10.10.5', 'cheat engine mac os x yosemite 10.10']"
keylogger for iphone free download,"['keylogger for iphone free download', 'keylogger for iphone 4 free download']"
cheat sheet fantasy football 2017,"['cheat sheet fantasy football 2017', 'cheat sheet fantasy football 2017 ppr', 'cheat sheet fantasy football 2017 printable', 'cheat sheet fantasy football 2017 ppr league']"
cheat engine 6.4 portable rar,['cheat engine 6.4 portable rar']
cheat engine tables list,['cheat engine tables list']
track cheating spouse iphone,"['track cheating spouse iphone', 'track my cheating spouse iphone']"
fallout 3 console commands item codes,"['fallout 3 console commands item codes', 'fallout 3 console commands item codes stimpack', 'fallout 3 console commands item id', 'fallout 3 new vegas console commands item codes', 'fallout 3 console commands get item id']"
can my husband track my car onstar,['can my husband track my car onstar']
family tracker application android,"['family tracker application android', 'family tracker app android', 'family tracker app android iphone', 'best family tracker app android', 'family phone tracker app android', 'family tracker app for android and ios devices', 'gps family tracker app android', 'family location tracker app android']"
family location tracker app android,"['family location tracker app android', 'family tracker app android', 'family tracker app android iphone', 'family tracking apps android market']"
spyro year of the dragon,"['spyro year of the dragon', 'spyro year of the dragon rom', 'spyro year of the dragon walkthrough', 'spyro year of the dragon cheats', 'spyro year of the dragonfly', 'spyro year of the dragon ps4', 'spyro year of the dragon ps2', 'spyro year of the dragon ps1', 'spyro year of the dragon cheat codes', 'spyro year of the dragon ps3']"
spy kids 3,"['spy kids 3', 'spy kids 3 cast', 'spy kids 3 game over', 'spy kids 3 full movie']"
cheat engine for mac os x free download,"['cheat engine for mac os x free download', 'cheat engine 6.1 free download for mac os x']"
friendship cheating quotes images,['friendship cheating quotes images']
cheat codes for gta 4 xbox 360,"['cheat codes for gta 4 xbox 360', 'cheat codes for gta 4 xbox 360 for guns', 'cheat codes for gta 4 xbox 360 tank', 'cheat codes for gta 4 xbox 360 the ballad of gay tony', 'cheat codes for gta 4 xbox 360 unlimited money', 'cheat codes for gta 4 xbox 360 boat', 'cheat codes for gta 4 xbox 360 parachute', 'cheat codes for gta 4 xbox 360 motorcycle', 'cheat codes for gta 4 xbox 360 lamborghini', 'cheat codes for gta 4 xbox 360 flying cars']"
cheat engine 6.6 tutorial,"['cheat engine 6.6 tutorial', 'cheat engine 6.6 tutorial step 6']"
cheatcc ps2 sims bustin out,['cheatcc ps2 sims bustin out']
fallout 3 cheats item list,"['fallout 3 cheats item list', 'fallout 3 cheats add item list', 'fallout 3 cheat code item list', 'fallout 3 cheats weapons list']"
cheating love quotes for her,"['cheating love quotes for her', 'love quotes for her after cheating']"
cheat engine 6.3 for macbook pro,['cheat engine 6.3 for macbook pro']
cheat codes for gta 4 xbox 360 parachute,"['cheat codes for gta 4 xbox 360 parachute', 'cheat codes for gta iv xbox 360 parachute', 'cheat codes for gta 4 xbox 360 money', 'cheat codes for gta 4 xbox 360 jetpack', 'cheat codes for gta 4 xbox 360 tank', 'cheat codes for gta 4 xbox 360 unlimited money', 'cheat codes for grand theft auto 4 xbox 360 army tank', 'cheat codes gta iv xbox 360 jetpack']"
cheat engine 6.4 portable full,['cheat engine 6.4 portable full']
spyro remake,"['spyro remake', 'spyro remake ps4', 'spyro remake confirmed', 'spyro remake 2018', 'spyro remake release date', 'spyro remake reddit', 'spyro remake e3', 'spyro remake unreal 4', 'spyro remake xbox one', 'spyro remake trilogy']"
cheat sheet synonym,"['cheat sheet synonym', 'cheat sheet thesaurus', 'define cheat sheet synonym']"
fallout 3 console commands get item id,"['fallout 3 console commands get item id', 'fallout 3 console commands item id']"
spyro gyra,"['spyro gyra', 'spyro gyra blue note', 'spyro gyra tour', 'spyro gyra youtube', 'spyro gyra shaker song', 'spyro gyra catching the sun', 'spyro gyra songs', 'spyro gyra jamesport', 'spyro gyra live', 'spyro gyra carnaval']"
cheat sheet fantasy football 2017 ppr,"['cheat sheet fantasy football 2017 ppr', 'cheat sheet fantasy football 2017 ppr league']"
read sms on pc iphone,"['read sms on pc iphone', 'read iphone sms.db on pc']"
cheat sheet mac,"['cheat sheet mac', 'cheat sheet machine learning', 'cheat sheet mac commands', 'cheat sheet mac keyboard shortcuts', 'cheat sheet mac shortcuts', 'cheat sheet mac terminal', 'cheat sheet machine learning medium']"
catch a cheating spouse cell phone spyware,"['catch a cheating spouse cell phone spyware', 'catch cheating spouse cell phone spy']"
track spouse visa application,"['track spouse visa application uk', 'track spouse visa application canada', 'track spouse visa application pakistan', 'track spouse visa application australia', 'track my spouse visa application', 'track australian spouse visa application', 'track your spouse visa application', 'fast track spouse visa application', 'how to track spouse visa application status for australia', 'how to track spouse visa application 2015']"
gps tracker app for iphone and android,"['gps tracker app for iphone and android', 'best gps tracker app for iphone and android', 'gps tracker app for android and ios', 'best gps tracker for iphone and android', 'gps tracker for both iphone and android']"
track spouses text messages,"['track spouses text messages', 'track spouses text messages free', 'track husbands text messages for free', 'track cheating spouse text messages', 'track spouse iphone text messages', 'track my wifes text messages', 'track my husbands text messages free', 'apps to track spouses text messages', 'track my wifes text messages for free']"
can my parents read my text messages metro pcs,[]
read android sms backup on pc,"['read android sms backup on pc', 'android sms backup on pc']"
family tracker app ios,"['family tracker app ios', 'family locator app ios', 'family tracker app iphone', 'family tracker app iphone and android', 'family tracker app store', 'family locator app iphone', 'family locator app iphone android', 'family locator app store', 'family locator app apple', 'best family tracker app iphone']"
can you read text messages on icloud,"['can you read text messages on icloud', 'can you read deleted text messages on icloud', 'can you read someones text messages on icloud', 'can you read text messages online icloud', 'can you read text messages thru icloud', 'can u read text messages through icloud', 'can you read your text messages through icloud', 'can you read other peoples text messages through icloud', 'can you access old text messages through icloud', 'can i access text messages on icloud']"
cheat engine for mac os x mountain lion,['cheat engine for mac os x mountain lion']
can read texts online at&t,"['can read texts online at&t', 'can parents read texts online at&t', 'can you read texts messages online at&t', 'can you read texts online through at&t', 'read texts online at&t']"
cheating boyfriend test,"['cheating boyfriend test', 'cheating boyfriend test free', 'cheating boyfriend test find out if', 'ultimate cheating boyfriend test', 'discover the cheating boyfriend test', 'signs of cheating boyfriend test', 'is my boyfriend cheating test', 'is your boyfriend cheating test']"
track spouse phone,"['track spouse phone', 'track spouse phone location', 'track spouse phone without them knowing', 'track spouse phone messages', 'track spouse phone calls', 'track activity on spouses phone', 'track spouse phone app', ""track wife's phone"", 'track my husband phone for free', 'track wifes phone free']"
blackberry read sms on pc,['blackberry read sms on pc']
cheat engine dark souls 3,"['cheat engine dark souls 3', 'cheat engine dark souls 3 ban', 'cheat engine dark souls 3 tutorial', 'cheat engine dark souls 3 guide', 'cheat engine dark souls 3 ps4', 'cheat engine dark souls 3 scripts', 'cheat engine dark souls 3 item list', 'cheat engine dark souls 3 1.14', 'cheat engine dark souls 3 spawn items', 'cheat engine dark souls 3 infinite health']"
spyro year of the dragonfly,"['spyro year of the dragonfly', 'spyro year of the dragonfly cheats', 'spyro year of the dragonfly walkthrough', 'spyro year of the dragonfly review', 'spyro year of the dragonfly iso', 'spyro enter the dragonfly ps2', 'spyro enter the dragonfly review', 'spyro enter the dragonfly gamecube', 'spyro enter the dragonfly cloud 9', 'spyro enter the dragonfly cheats gamecube']"
can u read text messages through icloud,"['can u read text messages through icloud', 'can you read text messages through icloud', 'can you read someones text messages through icloud', 'can you read your text messages through icloud', 'can you read other peoples text messages through icloud', 'can you read text messages online with icloud', 'can you access old text messages through icloud', 'can you read text messages thru icloud']"
cheating quotes for her in hindi,['cheating quotes for her in hindi']
cheat engine tables gone,['cheat engine tables gone']
cheat engine 6.3 roblox,"['cheat engine 6.3 roblox', 'cheat engine 6.3 roblox download', 'cheat engine 6.3 roblox codes', 'cheat engine 6.3 roblox apocalypse rising', 'cheat engine 6.3 roblox hacks', 'cheat engine 6.3 bypass roblox', 'roblox cheat engine 6.3 robux hack', 'roblox cheat engine 6.3 free download', 'roblox cheat engine 6.3 robux', 'roblox cheat engine 6.3 god mode']"
funny cheating stories yahoo,['funny cheating stories yahoo']
how to catch a cheating wife cell phone,"['how to catch a cheating wife cell phone', 'how to catch a cheating spouse cell phone', 'how to catch a cheating spouse using cell phone', 'how to catch a cheating spouse using cell phone for free', 'how to catch a cheating spouse through cell phone', 'how to catch a cheating spouse with his cell phone', 'how to catch wife cheating with cell phone trace', 'how to catch a cheating boyfriend cell phone', 'how to catch my wife cheating on her cell phone', 'how to catch a cheating husband on his cell phone']"
spyro enter the dragonfly,"['spyro enter the dragonfly', 'spyro enter the dragonfly cheats', 'spyro enter the dragonfly gamecube', 'spyro enter the dragonfly ps2', 'spyro enter the dragonfly walkthrough', 'spyro enter the dragonfly review', 'spyro enter the dragonfly iso', 'spyro enter the dragonfly speedrun', 'spyro enter the dragonfly gamecube iso', 'spyro enter the dragonfly kite']"
family locator pro,"['family locator pro apk', 'family locator pro', 'family locator pro life360', 'family locator program', 'verizon family locator problems', 'sprint family locator problems', 'life360 family locator problems', 'sygic family locator pro apk', 'download family locator pro apk', 'sprint family locator iphone problems']"
keylogger usb amazon,['keylogger usb amazon']
free gps tracking app,"['free gps tracking app', 'free gps tracking app for iphone', 'free gps tracking apps for android', 'free gps tracking app for employees', 'free gps tracking app for android and iphone', 'free gps tracking app for android phones', 'free gps tracker app', 'free gps tracker app for iphone', 'free gps tracker app for iphone and android', 'free gps locator app for android']"
cheat codes for gta v online,"['cheat codes for gta v online', 'cheat codes for gta v online ps4', 'cheat codes for gta v online ps3', 'cheat codes for gta v online for xbox 360', 'money cheat for gta v online', 'money cheat for gta v online ps3', 'money cheat for gta v online ps4', 'money cheats for gta v online xbox one', 'cheat codes for grand theft auto 5 online xbox 360']"
cheat sheet terraria,"['cheat sheet terraria', 'cheat sheet terraria install']"
how to catch a cheating husband on cell phone,"['how to catch a cheating husband on cell phone', 'how to catch a cheating husband on his cell phone']"
cheating quotes n images,['cheating quotes n images']
cheat engine tables reddit,['cheat engine tables reddit']
cheat codes for gta 4 xbox 360 unlimited money,"['cheat codes for gta 4 xbox 360 unlimited money', 'cheats for gta 4 xbox 360 unlimited money']"
keylogger usb keyboard,"['keylogger usb keyboard', 'usb keylogger wireless keyboard']"
gps tracking app for iphone,"['gps tracking app for iphone', 'gps tracking app for iphone and android', 'gps tracking app for iphone 6', 'gps tracking app for iphone free', 'gps tracking app for iphone review', 'gps tracking app for iphone 3g', 'gps tracker app for iphone 6', 'gps tracker app for iphone 4', 'gps locator app for iphone and android', 'gps tracking software for iphone 5']"
gps locator app for iphone,"['gps locator app for iphone', 'gps locator app for iphone and android', 'gps tracker app for iphone and android', 'gps tracker app for iphone 6', 'gps tracker app for iphone 4', 'gps tracking app for iphone 6', 'gps tracking app for iphone free', 'gps tracking app for iphone review', 'gps tracking app for iphone 3g', 'free gps locator app for iphone']"
cheat codes for gta 5 ps3 unlimited money online,['cheat codes for gta 5 ps3 unlimited money online']
cheat codes gta vice city stories psp plane,"['cheat codes gta vice city stories psp plane', 'cheat codes gta vice city stories psp jetpack', 'cheat codes gta vice city stories psp helicopter', 'cheat codes gta vice city stories psp airplane', 'cheat codes gta vice city stories psp get helicopter']"
cheating spouse tracker,"['cheating spouse tracker', 'cheating spouse tracker app', 'cheating spouse tracking app', 'cheating spouse tracking software', 'cheating spouse spy equipment', 'cheating spouse spy gear', 'cheating spouse spy', 'cheating spouse spy gadgets', 'cheating spouse spy devices', 'cheating spouse phone tracker']"
cheat engine 6.4 para mac,"['cheat engine 6.4 para mac', 'descargar cheat engine 6.4 para mac']"
cheat engine android no root gratis,['cheat engine android no root gratis']
cheat codes for gta vice city psp flying cars,['cheat codes for gta vice city psp flying cars']
family funds tracker pro,['family funds tracker pro']
catch your cheating spouse iphone app,['catch your cheating spouse iphone app']
cheat engine 6.3 macbook,"['cheat engine 6.3 macbook', 'cheat engine 6.3 apple', 'cheat engine 6.3 for macbook air', 'cheat engine 6.3 for macbook pro']"
cancel family locator sprint,"['cancel family locator sprint', 'disable family locator sprint']"
can i read my childs text messages online sprint,['can i read my childs text messages online sprint']
cheat codes for gta 4 xbox one,['cheat codes for gta 4 xbox one']
sprint family tracking plan,['sprint family tracking plan']
free gps tracker app for android,"['free gps tracker app for android', 'free gps tracking app for android and iphone', 'free gps tracking app for android phones', 'free gps tracking software for android', 'free gps tracking software for android phones', 'best free gps tracker app for android', 'free cell phone gps tracking app for android', 'free download gps tracking software for android tablet', 'free download gps tracking software for android', 'gps tracker app for android']"
cheating husband quotes pinterest,['cheating husband quotes pinterest']
cheating meme for him,['cheating meme for him']
family locator free download,"['family locator free download', 'family locator app free download', 'family locator apk free download', 'sprint family locator free download', 'locator font family free download', 'life360 family locator app free download', 'free download family locator 360']"
catch cheating spouse iphone app,"['catch cheating spouse iphone app', 'app to catch a cheating spouse iphone free']"
fallout 3 pc cheats weapon condition,['fallout 3 pc cheats weapon condition']
cheat engine 6.4 roblox windows 8,['cheat engine 6.4 roblox windows 8']
cheating stories yahoo answers,['cheating stories yahoo answers']
cheating spouse forums,"['cheating spouse forums', 'cheating spouse forum how to spot', 'cheating spouse support forums']"
spy stock,"['spy stock', 'spy stock price', 'spy stocktwits', 'spy stock price today', 'spy stock quote', 'spy stock chart', 'spy stock options', 'spy stock google', 'spy stock holdings', 'spy stock dividend']"
sprint family locator free download,['sprint family locator free download']
family tree tracker free,"['family tree tracker free', 'family tree trace free', 'family tree trace online free', 'free family tree tracker uk', 'free online family tree tracker']"
track girlfriends period,"['track girlfriends period', 'track girlfriends period app', 'track your girlfriends period', 'track your girlfriends period app', 'keep track of girlfriends period', 'android app to track girlfriends period']"
family tracker app for android and ios devices,['family tracker app for android and ios devices']
family tracking app for iphone,"['family tracking app for iphone', 'family tracking app for iphone and android', 'family tracker app for iphone', 'family locator app for iphone', 'family locator app for iphone and android', 'best family tracker app for iphone and android', 'free family tracker app for iphone', 'best family locator app for iphone', 'sprint family locator app for iphone', 'verizon family locator app for iphone']"
track girlfriend location,"['track girlfriend location', 'track my girlfriend location', 'track girlfriend iphone location', 'app to track girlfriend location']"
family locator apk free download,"['family locator apk free download', 'family tracker apk free download', 'free download donde esta family locator.apk']"
android keylogger without rooting,['android keylogger without rooting']
cheats for gta 4 xbox 360 unlimited money,"['cheats for gta 4 xbox 360 unlimited money', 'cheat codes for gta 4 xbox 360 unlimited money']"
descargar cheat engine 6.4 portable por mega,['descargar cheat engine 6.4 portable por mega']
how to catch my wife cheating on her cell phone,['how to catch my wife cheating on her cell phone']
spyro ps1,"['spyro ps1', 'spyro ps1 rom', 'spyro ps1 games', 'spyro ps1 cheats', 'spyro ps1 for sale', 'spyro ps1 games for sale', 'spyro ps1 controls', 'spyro ps1 amazon', 'spyro ps1 model', 'spyro ps1 ebay']"
cheat codes for gta vice city ps4,['cheat codes for gta vice city ps4']
can my parents read my texts online sprint,"['can my parents read my texts online sprint', 'can my parents read my text messages online sprint', 'can my parents check my texts online sprint']"
cheat engine coc for android no root apk free download,['cheat engine coc for android no root apk free download']
cheat codes for gta 4 tank,"['cheat codes for gta 4 tank', 'cheat codes for gta 4 tank ps3', 'cheat codes gta 4 tank xbox 360', 'cheat codes for grand theft auto 4 xbox 360 army tank', 'tank cheat code for gta 4 pc', 'cheats for gta 4 tank xbox 360', 'army tank cheat code for gta 4 ps3', 'cheat codes for grand theft auto 4 how to get a tank']"
catch my husband cheating his cell phone,"['catch my husband cheating his cell phone', 'catch my husband cheating cell phone']"
cheaters host beat up,"['cheaters host beat up', 'cheaters host gets beat up']"
spyro remake e3,['spyro remake e3']
best family locator app for android and iphone 2015,['best family locator app for android and iphone 2015']
track wife's iphone,"[""track wife's phone"", ""track wife's iphone"", ""track wife's phone location"", ""track wife's iphone without her knowing"", ""track my wife's iphone"", 'track your wife iphone', 'track cheating wife iphone', 'how to track my wifes iphone location', ""how to track wife's iphone 5"", 'track wife with find my iphone']"
cheat engine 6.4 per mac,"['cheat engine 6.4 per mac', 'cheat engine 6.4 for mac', 'cheat engine 6.4 for macbook', 'cheat engine 6.4 for macbook pro', 'download cheat engine 6.4 for macbook', 'cheat engine 6.4 mac os x', 'cheat engine 6.4 mac os']"
can my parents check my texts online sprint,"['can my parents check my texts online sprint', 'can my parents read my texts online sprint', 'can my parents read my text messages online sprint']"
cheaters never prosper,"['cheaters never prosper', 'cheaters never prosper meme', 'cheaters never prosper pt 3', 'cheaters never prosper quote', 'cheaters never prosper trivia', 'cheaters never prosper sleeping dogs', 'cheaters never prosper essay', 'cheaters never prosper book', 'cheaters never prosper fantasy football', 'cheaters never prosper major crimes']"
cheating memes facebook,['cheating memes facebook']
family gps tracker app for android,"['family gps tracker app for android', 'best gps family tracker app for android', 'best gps family tracking app for android', 'gps family tracker apps android market', 'family gps tracker for android and iphone', 'family gps tracker for android 2.1']"
tracking ups store,"['tracking ups store', 'tracking ups store ogdensburg', 'ups tracking store locations', 'tracking number ups store', 'usps tracking ups store', 'ups tracking mobile store', ""ups store tracking number doesn't work"", 'ups store tracking receipt id', 'ups store tracking phone number', 'ups store tracking number not found']"
cheat engine 6.3 for macbook air,['cheat engine 6.3 for macbook air']
read texts from another phone free,"['read texts from another phone free', 'read sms from another phone free', 'read another phones text messages free', 'read text messages from another phone online for free']"
family locator app ios,"['family locator app ios', 'family locator app iphone', 'family locator app iphone android', 'family locator app apple', 'family tracking app iphone', 'free family locator app iphone', 'best family locator app iphone', 'family locator app verizon iphone', 'sprint family locator app iphone', 'best family locator app for ios']"
cheating spouse meme,['cheating spouse meme']
cheat codes for gta 5 ps3 cop car,['cheat codes for gta 5 ps3 cop car']
android text messages on pc,"['android text messages on pc', 'read android text messages on pc', 'receive android text messages on pc', 'manage android text messages on pc', 'android text messages backup to pc', 'how to block text messages on android metro pcs', 'how to find text messages on android from pc']"
cheat engine 6.4 roblox download,"['cheat engine 6.4 roblox download', 'cheat engine 6.4 free download roblox', 'speed hack roblox cheat engine 6.4 download']"
cheat engine tables borderlands 2,"['cheat engine tables borderlands 2', 'technojacker cheat engine table borderlands 2', 'how to use cheat engine table borderlands 2', 'cheat engine borderlands 2 table steam']"
cheaters never prosper fantasy football,['cheaters never prosper fantasy football']
cheat engine 6.4 portable no admin,['cheat engine 6.4 portable no admin']
cheat engine 6.4 mac os x,['cheat engine 6.4 mac os x']
cheat sheet mac keyboard shortcuts,"['cheat sheet mac keyboard shortcuts', 'eclipse mac keyboard shortcuts cheat sheet', 'photoshop cs6 keyboard shortcuts cheat sheet mac']"
