term,terms
cheat codes for gta 5 ps3 for cars,"['cheat codes for gta 5 ps3 for cars', 'cheat codes for gta 5 ps3 flying cars', 'cheat codes for gta 5 ps3 all cars', 'cheat codes for gta 5 ps3 repair car', 'cheat codes for gta 5 ps3 cop car']"
how to track your girlfriends text messages for free,['how to track your girlfriends text messages for free']
read sms messages from another phone,"['read sms messages from another phone', 'read text messages from another phone', 'read text messages from another phone verizon', 'read text messages from another phone online', 'read text messages from another phone online for free', 'read text messages from another phone software', 'read another phones text messages', 'how to read text messages from another phone without installing software', 'how to read text messages from another phone without them knowing', 'how can i read text messages from another phone on my verizon account']"
free gps tracking app for iphone and android,"['free gps tracking app for iphone and android', 'best gps tracker app for iphone and android', 'gps locator app for iphone and android']"
catch your spouse cheating free app,['catch your spouse cheating free app']
dirt track girlfriend shirts,"['dirt track girlfriend shirts', 'dirt track racing girlfriend shirts']"
cheat codes for gta 5 ps3 offline,['cheat codes for gta 5 ps3 offline']
track cheating spouse car,['track cheating spouse car']
cheat codes for gta 5 ps3 unlimited ammo,['cheat codes for gta 5 ps3 unlimited ammo']
track spouse iphone,"['track spouse iphone', 'track spouse iphone text messages', 'track spouse iphone free', ""track wife's iphone"", ""track wife's iphone without her knowing"", 'track my husband iphone', 'track cheating spouse iphone', 'secretly track spouse iphone', 'how to track spouse iphone without them knowing', 'track my cheating spouse iphone']"
track girlfriend whatsapp,"['track girlfriend whatsapp', 'track my girlfriend whatsapp']"
cheat engine tables,"['cheat engine tables', 'cheat engine tables dishonored 2', 'cheat engine tables gone', 'cheat engine tables list', 'cheat engine tables dark souls 3', 'cheat engine tables reddit', 'cheat engine tables not working', 'cheat engine tables borderlands 2', 'cheat engine tables dark souls 2', 'cheat engine tables how to use']"
cheat engine for mac,"['cheat engine for mac', 'cheat engine for mac 2017', 'cheat engine for mac os sierra', 'cheat engine for mac os x', 'cheat engine for mac os', 'cheat engine for mac 10.6.8']"
sprint family locator login page web enabled,['sprint family locator login page web enabled']
cheat codes for gta 5 ps3 flying cars,['cheat codes for gta 5 ps3 flying cars']
cheat engine 6.4 for android no root,['cheat engine 6.4 for android no root']
cheat engine android,"['cheat engine android', 'cheat engine android without root', 'cheat engine android root', 'cheat engine android emulator', 'cheat engine android apk no root', 'cheat engine android games', 'cheat engine android reddit', 'cheat engine android tutorial', 'cheat engine android server', 'cheat engine android remote system']"
read texts online,"['read texts online', 'read texts online verizon', 'read texts online sprint', 'read texts online tmobile', 'read texts online iphone', 'read texts online free', 'read texts online at&t', 'read texts online metro pcs', 'read texts online android', 'read texts online boost mobile']"
track my husband car,"['track my husband car', 'how to track my husband car without him knowing', 'can my husband track my car onstar']"
spyfall,"['spyfall', 'spyfall 2', 'spyfall rules', 'spyfall locations', 'spyfall app', 'spyfall questions', 'spyfall how to play', 'spyfall 2 locations', 'spyfall review', 'spyfall app rules']"
track your girlfriend iphone app,['track your girlfriend iphone app']
family tracker app for android,"['family tracker app for android', 'family tracker app for android and ios devices', 'family tracker app for android and iphone', 'family locator app for android', 'family locator app for android reviews', 'family gps tracker app for android', 'best family tracker app for android', 'family tracker application android', 'best gps family tracker app for android', 'best family locator app for android']"
cheat codes for gta v,"['cheat codes for gta v', 'cheat codes for gta v ps4', 'cheat codes for gta v ps3', 'cheat codes for gta vice city ps2', 'cheat codes for gta v online', 'cheat codes for gta vice city', 'cheat codes for gta v for xbox 360', 'cheat codes for gta v pc', 'cheat codes for gta vice city psp', 'cheat codes for gta v for playstation 4']"
cheat codes for gta vice city,"['cheat codes for gta vice city ps2', 'cheat codes for gta vice city', 'cheat codes for gta vice city psp', 'cheat codes for gta vice city ps4', 'cheat codes for gta vice city xbox', 'cheat codes for gta vice city stories psp', 'cheat codes for gta vice city stories ps2', 'cheat codes for gta vice city android', 'cheat codes for gta vice city xbox 360', 'cheat codes for gta vice city mobile']"
sprint family locator app for iphone 6,['sprint family locator app for iphone 6']
disable family locator sprint,"['disable family locator sprint', 'disable sprint family locator iphone', 'disable sprint family locator android']"
family tracking app for iphone and android,"['family tracking app for iphone and android', 'family locator app for iphone and android', 'best family tracker app for iphone and android', 'best family locator app for iphone and android']"
read sms messages on icloud,"['read sms messages on icloud', 'can you read sms messages on icloud', 'read text messages online icloud', 'read text messages from icloud backup']"
cheat engine for mac os x,"['cheat engine for mac os x', 'cheat engine for mac os x yosemite', 'cheat engine for mac os x el capitan', 'cheat engine for mac os x free download', 'cheat engine for mac os x tutorial   download', 'cheat engine for mac os x 10.10', 'cheat engine for mac os x 10.7.5', 'cheat engine for mac os x 10.9.5', 'cheat engine for mac os x mountain lion', 'cheat engine for mac os x tutorial']"
read my text messages online sprint,"['read my text messages online sprint', 'can i read my text messages online sprint', 'can someone read my text messages online sprint', 'can my parents read my text messages online sprint', 'can i read my childs text messages online sprint', 'can i read my daughters text messages online sprint']"
cheatcc pc sims 4,['cheatcc pc sims 4']
cheat engine tables not working,['cheat engine tables not working']
windows phone read sms on pc,['windows phone read sms on pc']
cheat engine android without root,"['cheat engine android without root', 'cheat engine android without root - apkforandroids.com', 'cheat engine android no root apk', 'cheat engine android no root needed', 'cheat engine android no root gratis', 'cheat engine for android no root for clash of clans', 'cheat engine for android no root 2014', 'cara menggunakan cheat engine android no root', 'cheat engine di hp android no root']"
can parents read text messages metropcs,"['can parents read text messages metropcs', 'can my parents read my text messages metro pcs']"
cheat codes for gta vice city psp,"['cheat codes for gta vice city psp', 'cheat codes for gta vice city psp flying cars', 'cheat codes for gta vice city psp helicopter cheats', 'cheat codes for gta vice city psp vita', 'cheat codes for gta vice city psp tank', 'cheat codes for gta vice city psp jetpack', 'cheat codes for gta vice city psp 2', 'cheat codes for grand theft auto vice city psp helicopter', 'cheat codes for gta vice city stories ps2', 'cheat codes for gta vice city stories pc edition']"
how can i track my girlfriend text messages,['how can i track my girlfriend text messages']
keylogger for iphone,"['keylogger for iphone', 'keylogger for iphone free', 'keylogger for iphone 6', 'keylogger for iphone 7', 'keylogger for iphone no jailbreak', 'keylogger for iphone remote install', 'keylogger for iphone without jailbreak', 'keylogger for iphone 5', 'keylogger for iphone free trial', 'keylogger for iphone free download']"
spyro the dragon ps4,"['spyro the dragon ps4', 'spyro the dragon ps4 remaster', 'spyro the dragon ps4 2017', 'spyro the dragon ps4 download', 'spyro the dragon ps4 store', 'spyro the dragon ps4 remake', 'spyro the dragon ps4 game', 'spyro the dragon ps4 e3', 'spyro the dragon ps4 reddit']"
spy kids,"['spy kids', 'spy kids cast', 'spy kids 3', 'spy kids 2', 'spy kids 4', 'spy kids thumb', 'spy kids 3 cast', 'spy kids 2 cast', 'spy kids movies', 'spy kids 1']"
cheatcc ps2 guitar hero 3,['cheatcc ps2 guitar hero 3']
catch cheating husband cell phone,"['catch cheating husband cell phone', 'catch my husband cheating cell phone']"
keylogger virus,"['keylogger virus', 'keylogger virus download', 'keylogger virus iphone', 'keylogger virus removal', 'keylogger virus mac', 'keylogger virus definition', 'keylogger virus code', 'keylogger virus examples', 'keylogger virus android', 'keylogger virus scan']"
family tracker pro,"['family tracker pro', 'family tracker pro apk', 'family tracker pro reviews', 'family locator pro apk', 'family locator pro', 'family locator pro life360', 'family gps tracker pro', 'family gps tracker pro apk', 'family funds tracker pro', 'family tracker locate phones pro apk']"
read texts online boost mobile,['read texts online boost mobile']
read sms backup on pc,"['read sms backup on pc', 'read android sms backup on pc', 'read htc sms backup on pc', 'read sms backup file on pc', 'how to read iphone sms backup file on pc']"
catch cheating spouse with iphone 6,['catch cheating spouse with iphone 6']
samsung galaxy s3 read sms on pc,"['samsung galaxy s3 read sms on pc', 'samsung galaxy s3 read text messages on pc']"
best family locator app free,"['best family locator app free', 'family locator app free download', 'family locator app free', 'best free family locator app 2015']"
cheat engine 6.3,"['cheat engine 6.3', 'cheat engine 6.3 mac', 'cheat engine 6.3 roblox', 'cheat engine 6.3 heart of vegas', 'cheat engine 6.3 6.4', 'cheat engine 6.3 softonic', 'cheat engine 6.3 indir', 'cheat engine 6.3.0.4', 'cheat engine 6.3 portable', 'cheat engine 6.3 apk no root']"
track spouse iphone text messages,['track spouse iphone text messages']
cheating stories,"['cheating stories', 'cheating stories reddit', 'cheating stories on choices', 'cheating stories buzzfeed', 'cheating stories wattpad', 'cheating stories podcast', 'cheating stories funny', 'cheating stories yahoo', 'cheating stories that are heartbreaking', 'cheating stories with pictures']"
family tracker pro reviews,['family tracker pro reviews']
free gps tracker app,"['free gps tracker app', 'free gps tracker app for iphone', 'free gps tracker app for android', 'free gps tracking app', 'free gps tracking app for iphone', 'free gps tracking app for iphone and android', 'free gps tracking app for android phones', 'free gps tracking app for blackberry', 'free gps tracking app for ipad', 'free gps tracking app for employees']"
descargar cheat engine 6.4 mac,"['descargar cheat engine 6.4 mac', 'download cheat engine 6.4 mac', 'download cheat engine 6.4 for macbook', 'descargar cheat engine 6.4 para mac']"
spyro the dragon ps4 remaster,['spyro the dragon ps4 remastered']
fallout 3 cheat item codes,"['fallout 3 cheat item codes', 'fallout 3 console item codes stimpack', 'fallout 3 cheat code item list', 'fallout 3 console item id', 'fallout 3 console commands item codes', 'fallout 3 item codes list', 'fallout 3 item codes wiki', 'fallout 3 item codes dlc', 'fallout 3 item codes xbox 360', 'fallout 3 item codes caps']"
cheating quotes for him images,['cheating quotes for him images']
read texts out loud android,"['read texts out loud android', 'read sms out loud android', 'read text messages out loud android', 'read text out loud app for android']"
can my dad read my texts online sprint,"['can my dad read my texts online sprint', 'can my parents read my texts online sprint', 'can my parents read my text messages online sprint', 'can my parents check my texts online sprint']"
cheat engine 6.4 portable,"['cheat engine 6.4 portable', 'cheat engine 6.4 portable rar', 'cheat engine 6.4 portable no admin', 'cheat engine 6.4 portable free download', 'cheat engine 6.4 portable mega', 'cheat engine 6.4 portable vn-zoom', 'descargar cheat engine 6.4 portable', 'descargar cheat engine 6.4 portable mega', 'cheat engine 6.4 portable rus', 'cheat engine 6.4 portable full']"
family locator sprint plan,['family locator sprint plan']
read texts on computer android,"['read texts on computer android', 'read text messages on computer android']"
cheat sheet,"['cheat sheet', 'cheat sheet template', 'cheat sheet meaning', 'cheat sheet terraria', 'cheat sheet fantasy football 2017', 'cheat sheet synonym', 'cheat sheet mac', 'cheat sheet creator', 'cheat sheet for word cookies', 'cheat sheet for poker']"
cheaters,"['cheaters', 'cheaters spy shop', 'cheaters show', 'cheaters caught', 'cheaters website', 'cheaters meme', 'cheaters host', 'cheaters app', 'cheaters host stabbed', 'cheaters never prosper']"
how to track my girlfriends facebook messages,['how to track my girlfriends facebook messages']
iphone family tracker free,['iphone family tracker free']
keylogger android,"['keylogger android', 'keylogger android free', 'keylogger android apk', 'keylogger android no root', 'keylogger android reddit', 'keylogger android detect', 'keylogger android remote install', 'keylogger android tanpa root', 'keylogger android github', 'keylogger android terbaik']"
cheatcc ps2 the warriors,['cheatcc ps2 the warriors']
can my parents read my text messages online sprint,['can my parents read my text messages online sprint']
cheat engine android no root apk,"['cheat engine android no root apk download', 'cheat engine for android no root apk free download fnaf 2', 'cheat engine for android no root apk free download', 'cheat engine coc for android no root apk free download', 'cheat engine para android apk no root']"
best free family locator app for iphone,"['best free family locator app for iphone', 'free family locator app for iphone']"
cheat engine 6.3 6.4,"['cheat engine 6.3 6.4', 'cheat engine 6.3 6.4 download', 'difference between cheat engine 6.3 and 6.4', 'cheat engine 6.4 to 6.3']"
track,"['tracking number', 'tracking', 'track package', 'track flight', 'tracking usps', 'tracking ups', 'trackr', 'track and field', 'track fedex', 'tracker']"
fallout 3 cheat code item list,"['fallout 3 cheat code item list', 'fallout 3 cheats item list']"
cheat engine for mac os x tutorial,"['cheat engine for mac os x tutorial   download', 'cheat engine for mac os x tutorial']"
cheat codes for gta 4,"['cheat codes for gta 4', 'cheat codes for gta 4 xbox 360', 'cheat codes for gta 4 ps3', 'cheat codes for gta 4 xbox one', 'cheat codes for gta 4 ps4', 'cheat codes for gta 4 money', 'cheat codes for gta 4 cars', 'cheat codes for gta 4 ps3 money', 'cheat codes for gta 4 pc', 'cheat codes for gta 4 tank']"
cheating stories yahoo,"['cheating stories yahoo', 'cheating stories yahoo answers', 'funny cheating stories yahoo']"
read text messages from another phone software,"['read text messages from another phone software', 'how to read text messages from another phone without installing software']"
track spouses cell phone location,"['track spouses cell phone location', 'track my wifes cell phone location', ""how to track wife's cell phone location""]"
read another phones text messages,"['read another phones text messages free', 'read another phones text messages', 'app to read another phones text messages', 'can you read other phones text messages', 'app to read other phones text messages', 'iphone app to read another phones text messages', 'read phone text messages from computer', 'read phone text messages', 'read phone text messages on ipad', 'read phone text messages online']"
keylogger android detect,"['keylogger android detect', 'keylogger detector android', 'detectar keylogger android']"
cheat codes for gta 5 ps3 tank,"['cheat codes for gta 5 ps3 tank', 'cheat codes for gta 5 ps3 money', 'cheat codes for gta 5 ps3 army tank', 'cheat codes for gta 5 ps3 free money', 'cheat codes for gta 5 ps3 unlimited money online']"
cheating quotes in spanish,"['cheating quotes in spanish', 'cheating quotes for him in spanish']"
cheating spouse revenge reddit,['cheating spouse revenge reddit']
family gps tracker free download,['family gps tracker free download']
cheat codes for gta 5 ps3 free money,['cheat codes for gta 5 ps3 free money']
free gps tracker app for iphone,"['free gps tracker app for iphone', 'free gps tracking app for iphone', 'free gps tracking app for iphone and android', 'free gps tracking software for iphone', 'best free gps tracker app for iphone', 'best free gps tracking app for iphone', 'gps tracker app for iphone', 'gps tracker app for iphone 6', 'gps tracker app for iphone 4', 'free gps tracker for iphone']"
funny cheating quotes for her,['funny cheating quotes for her']
family tracker app for iphone and android,"['family tracker app for iphone and android', 'family locator app for iphone and android', 'best family tracker app for iphone and android', 'best family locator app for iphone and android']"
read htc sms on pc,"['read htc sms on pc', 'read htc sms backup on pc']"
can you read sms messages on icloud,"['can you read sms messages on icloud', 'can you read text messages on icloud', 'can you read deleted text messages on icloud', 'can you read someones text messages on icloud', 'can you read sms on icloud', 'can you read text messages thru icloud', 'can u read text messages through icloud', 'can you read your text messages through icloud', 'can you read deleted texts on icloud', 'can you read someones texts on icloud']"
cheat codes for gta vice city stories psp,"['cheat codes for gta vice city stories psp', 'cheat codes for gta vice city stories psp jetpack', 'cheat codes for gta vice city stories psp flying cars', 'cheat codes for gta vice city stories psp airplane', 'cheat codes for grand theft auto vice city stories psp helicopter', 'cheat codes for grand theft auto vice city stories psp go', 'cheat codes gta vice city stories psp cars drive on water', 'cheat codes gta vice city stories psp get helicopter', 'cheat codes gta vice city stories psp plane', 'tank cheat code for gta vice city stories psp']"
catch my husband cheating cell phone,"['catch my husband cheating cell phone', 'catch my husband cheating his cell phone']"
keylogger virus code,"['keylogger virus code', 'keylogger virus making']"
nokia read sms on pc,['nokia read sms on pc']
fallout 3 weapon cheat codes xbox 360,"['fallout 3 weapon cheat codes xbox 360', 'fallout 3 cheat codes xbox 360 god mode', 'fallout 3 cheat codes xbox 360 infinite ammo', 'fallout 3 cheat codes xbox 360 youtube', 'fallout 3 new vegas cheat codes xbox 360']"
software to read text messages on pc,['software to read text messages on pc']
verizon wireless family locator review,['verizon wireless family locator review']
family locator app sprint,"['family locator app sprint', 'sprint family locator app for iphone', 'sprint family locator app for android', 'sprint family locator app for ipad', 'sprint family locator app for iphone 5', 'sprint family locator app reviews', 'sprint family locator app for iphone 6', 'sprint family locator blocker app']"
cheat engine download,"['cheat engine download', 'cheat engine download windows 10', 'cheat engine download mac', 'cheat engine download android', 'cheat engine download 6.6', 'cheat engine download unblocked', 'cheat engine download 6.4', 'cheat engine download 6.7', 'cheat engine download no virus', 'cheat engine download pc']"
cheat engine 6.4 portable vn-zoom,['cheat engine 6.4 portable vn-zoom']
cheat engine 6.6,"['cheat engine 6.6', 'cheat engine 6.6 download', 'cheat engine 6.6 mac', 'cheat engine 6.6 tutorial', 'cheat engine 6.6 virus', 'cheat engine 6.6 roblox', 'cheat engine 6.6 borderlands 2', 'cheat engine 6.6 apk', 'cheat engine 6.6 dark souls 3', 'cheat engine 6.6 portable']"
how to read iphone sms backup file on pc,['how to read iphone sms backup file on pc']
keylogger for iphone remote install,['keylogger for iphone remote install']
cheatcc ps2 battlefront 2,"['cheatcc ps2 battlefront 2', 'cheatcc ps2 star wars battlefront 2']"
detectar keylogger android,"['detectar keylogger android', 'como detectar keylogger en android']"
track my girlfriend whatsapp,['track my girlfriend whatsapp']
family tracker locate phones pro apk,['family tracker locate phones pro apk']
how to track spouse iphone without them knowing,['how to track spouse iphone without them knowing']
read android text messages on pc,"['read android text messages on pc', 'android text messages on pc', 'receive android text messages on pc', 'manage android text messages on pc']"
cheat codes band lead singer,['cheat codes band lead singer']
read text messages from icloud backup,"['read text messages from icloud backup', 'access text messages from icloud backup']"
catch cheating spouse cell phone spy,"['catch cheating spouse cell phone spy', 'catch a cheating spouse cell phone spyware']"
cheat engine for mac os x tutorial   download,['cheat engine for mac os x tutorial   download']
cheat codes for gta vice city psp jetpack,"['cheat codes for gta vice city psp jetpack', 'cheat codes for gta vice city psp flying cars', 'cheat codes for gta vice city psp helicopter', 'cheat codes for gta vice city psp tank', 'cheat codes for gta vice city stories psp jetpack', 'cheat codes grand theft auto vice city psp jetpack', 'cheat codes for grand theft auto vice city stories helicopter', 'cheat codes grand theft auto vice city stories psp tank', 'cheat codes gta vice city stories psp get helicopter', 'cheat code for boat in gta vice city psp']"
family tracking sprint,"['family tracking sprint', 'sprint family locator', 'sprint family tracking plan']"
app to read text messages on ipad,['app to read text messages on ipad']
free gps locator app for iphone,"['free gps tracking app for iphone', 'free gps tracking app for iphone and android', 'free gps tracker app for iphone', 'best free gps tracking app for iphone', 'best free gps tracker app for iphone', 'gps locator app for iphone', 'gps locator app for iphone and android', 'gps tracker app for iphone 6', 'gps tracker app for iphone 4', 'gps tracking app for iphone 6']"
how to catch a cheating spouse using cell phone for free,['how to catch a cheating spouse using cell phone for free']
cheatcc ps2 san andreas,['cheatcc ps2 san andreas']
keylogger for iphone 6,"['keylogger for iphone 6', 'keylogger for iphone 6 without jailbreak', 'remote keylogger for iphone 6', 'keylogger software for iphone 6', 'keylogger iphone 6 no jailbreak', 'keylogger iphone ios 6', 'keylogger detector iphone 6', 'keylogger para iphone 6', 'keylogger cho iphone 6', 'keylogger per iphone 6']"
fallout 3 cheats pc steam,"['fallout 3 cheats pc steam', 'fallout 3 goty cheats pc steam', 'fallout 3 cheats steam version']"
cheating quotes images,"['cheating quotes images', 'cheating quotes images in tamil', 'cheating quotes images in malayalam', 'cheating boyfriend quotes images', 'love cheating quotes images', 'cheating husband quotes images', 'cheating girlfriend quotes images', 'cheating quotes funny images', 'friendship cheating quotes images', 'cheating quotes n images']"
spyro the dragon ps4 reddit,['spyro the dragon ps4 reddit']
cheatcc gta 5 ps4,['cheatcc gta 5 ps4']
family locator free apk,['family locator free apk']
cheating meme,"['cheating meme', 'cheating memes for her', 'cheating memes funny', 'cheating memes instagram', 'cheating meme 2017', 'cheating meme for him', 'cheating meme generator', 'cheating meme quotes', 'cheating memes facebook', 'cheating meme video']"
cheaters host,"['cheaters host', 'cheaters host stabbed', 'cheaters host clark gable', 'cheaters host get stabbed', 'cheaters host tommy habeeb', 'cheaters host dead', 'cheaters host stabbed youtube', 'cheaters host killed', 'cheaters host beat up', 'cheaters host gets shot']"
cheatcc pc sims 3,['cheatcc pc sims 3']
cheat codes for gta vice city xbox 360,"['cheat codes for gta vice city xbox 360', 'cheat codes for gta vice city stories for xbox 360']"
cheat codes ps4,"['cheat codes ps4', 'cheat codes ps4 gta 5', 'cheat codes ps4 san andreas', 'cheat codes ps4 crash bandicoot', 'cheat codes ps4 fallout 4', 'cheat codes ps4 2k17', 'cheat codes ps4 watch dogs 2', 'cheat codes ps4 watch dogs', 'cheat codes ps4 gta 5 online', 'cheat codes ps4 injustice 2']"
como detectar keylogger en android,"['como detectar keylogger en android', 'como detectar un keylogger en mi android']"
keylogger android reddit,['keylogger android reddit']
read texts online at&t,"['read texts online at&t', 'read my texts online at&t', 'can read texts online at&t', 'can parents read texts online at&t', 'can you read texts messages online at&t', 'can you read texts online through at&t']"
read sms texts online free,['read sms texts online free']
tracking ups,"['tracking ups', 'tracking ups freight', 'tracking ups surepost', 'tracking usps', 'tracking ups truck', 'tracking ups mail innovations', 'tracking ups without tracking number', 'tracking ups store', 'tracking ups infonotice', 'tracking ups air freight']"
can i read my text messages online sprint,"['can i read my text messages online sprint', 'can i read my childs text messages online sprint', 'can i read my daughters text messages online sprint', 'can someone read my text messages online sprint', 'can my parents read my text messages online sprint', 'read my text messages online sprint']"
cheat codes for gta 5 ps3 more ammo,['cheat codes for gta 5 ps3 more ammo']
fallout 3 cheat codes xbox 360 youtube,['fallout 3 cheat codes xbox 360 youtube']
