term,terms
family tracker,"['family tracker', 'family tracker app', 'family tracker free', 'family tracker app free', 'family tracker verizon', 'family tracker iphone', 'family tracker sprint', 'family tracker app reviews', 'family tracker app for iphone', 'family tracker pro']"
family tracker app for iphone,"['family tracker app for iphone', 'family tracker app for iphone and android', 'family locator app for iphone', 'family locator app for iphone and android', 'best family tracker app for iphone and android', 'best family tracker app for iphone', 'free family tracker app for iphone', 'best family locator app for iphone', 'sprint family locator app for iphone', 'verizon family locator app for iphone']"
family tracker sprint,"['family tracker sprint', 'family locator sprint', 'family locator sprint iphone', 'family locator sprint plan', 'family locator sprint hack', 'family locator sprint login page', 'family locator sprint reviews', 'sprint family tracker block']"
family locator sprint reviews,"['family locator sprint reviews', 'sprint family locator app reviews']"
sprint family tracker block,"['sprint family tracker block', 'sprint family locator blocker app', 'sprint family locator block text']"
track girlfriend,"['track girlfriend', 'track girlfriend app', 'track girlfriends iphone', 'track girlfriends phone free', 'track girlfriends facebook messages', 'track girlfriend shirts', 'track girlfriend location', 'track girlfriends period', 'track girlfriend text messages', 'track girlfriend whatsapp']"
sprint family locator block text,['sprint family locator block text']
catch cheating spouse,"['catch cheating spouse', 'catch cheating spouse free', 'catch cheating spouse iphone', 'catch cheating spouse cell phone for free', 'catch cheating spouse text messages free', 'catch cheating spouse app', 'catch cheating spouse android phone', 'catch cheating spouse camera', 'catch cheating spouse cell phone', 'catch cheating spouse app iphone']"
family tracker app free,"['family tracker app free', 'family locator app free download', 'best family locator app free', 'free family tracker app for iphone', 'free family gps tracker app']"
family locator app for iphone and android,"['family locator app for iphone and android', 'family tracking app for iphone and android', 'best family locator app for iphone and android', 'best family locator app for android and iphone 2015']"
cheat,"['cheat codes', 'cheat engine', 'cheating', 'cheaters', 'cheatbreaker', 'cheat sheet', 'cheat codes for gta 5', 'cheatcc', 'cheat codes for gta 5 ps3', 'cheating quotes']"
read sms,"['read sms', 'read sms online', 'read sms messages', 'read sms on pc', 'read sms messages android', 'read sms messages on pc', 'read sms backup file on pc', 'read sms messages on computer', 'read sms online free', 'read sms out loud android']"
verizon family locator app for iphone,"['verizon family locator app for iphone', 'verizon wireless family locator app for iphone']"
free family tracker app for iphone,"['free family tracker app for iphone', 'free family locator app for iphone', 'best free family locator app for iphone']"
best family locator app for iphone and android,"['best family locator app for iphone and android', 'family locator app for iphone and android', 'best family locator app for android and iphone 2015']"
track girlfriend app,"['track girlfriend app', 'track girlfriend period app', 'track your girlfriend iphone app']"
catch cheating spouse cell phone,"['catch cheating spouse cell phone for free', 'catch cheating spouse cell phone', 'catch cheating spouse cell phone software', 'catch cheating spouse cell phone free trial', 'catch cheating spouse cell phone spy', 'catch cheating husband cell phone', 'catch cheating wife cell phone', 'catch cheating spouse using cell phone', 'catch my husband cheating cell phone', 'how to catch a cheating spouse with his cell phone']"
track girlfriends facebook messages,"['track girlfriends facebook messages', 'how to track my girlfriends facebook messages']"
catch cheating spouse cell phone for free,"['catch cheating spouse cell phone for free', 'catch cheating spouse cell phone free trial']"
read sms on pc,"['read sms on pc', 'read sms on pc android', 'read sms on pc iphone', 'read sms on pc software', 'samsung read sms on pc', 'nokia read sms on pc', 'blackberry read sms on pc', 'read sms backup on pc', 'read htc sms on pc', 'windows phone read sms on pc']"
verizon wireless family locator app for iphone,['verizon wireless family locator app for iphone']
sprint family locator app for iphone,"['sprint family locator app for iphone', 'sprint family locator app for iphone 5', 'sprint family locator app for iphone 6', 'sprint family locator review iphone']"
read sms on pc software,['read sms on pc software']
track spouse,"['track spouse phone', 'track spouse', 'track spouse iphone', 'track spouses cell phone location', 'track spouse car', 'track spouses text messages', 'track spouse phone location', 'track spouse iphone text messages', 'track spouse visa application uk', 'track spouse app']"
how to catch a cheating spouse with his cell phone,"['how to catch a cheating spouse with his cell phone', 'how to catch a cheating spouse with their cell phone', 'how to catch a cheating spouse using cell phone', 'how to catch a cheating spouse using cell phone for free', 'how to catch a cheating spouse through cell phone', 'how to catch a cheating wife cell phone', 'how to catch wife cheating with cell phone trace']"
catch cheating spouse text messages free,['catch cheating spouse text messages free']
free family gps tracker app,"['free family gps tracker app', 'free gps tracker app', 'free gps tracker app for iphone', 'free gps tracking app', 'free gps tracking app for iphone']"
sprint family locator app for iphone 5,['sprint family locator app for iphone 5']
spy,"['spyder', 'spy', 'spyder movie review', 'spyfall', 'spy kids', 'spy dialer', 'spy stock', 'spy camera', 'spyro', 'spyderco']"
sprint family locator app reviews,['sprint family locator app reviews']
cheat engine,"['cheat engine', 'cheat engine download', 'cheat engine 6.6', 'cheat engine 6.4', 'cheat engine android', 'cheat engine tables', 'cheat engine for mac', 'cheat engine 6.3', 'cheat engine dark souls 3', 'cheat engine roblox']"
cheatcc,"['cheatcc', 'cheatcc ps3', 'cheatcc xbox one', 'cheatcc xbox 360', 'cheatcc gta 5', 'cheatcc ps2', 'cheatcc gta 5 xbox one', 'cheatcc gta 5 ps4', 'cheatcc gta 5 ps3', 'cheatcc pc']"
track spouse car,"['track spouse car', 'track my husband car', 'track cheating spouse car']"
read texts,"['read texts', 'read texts online', 'read texts on icloud', 'read texts on computer', 'read texts online verizon', 'read texts from another phone free', 'read texts online sprint', 'read texts out loud android', 'read texts on computer android', 'read texts on computer iphone']"
catch cheating spouse camera,"['catch cheating spouse camera', 'catch your spouse cheating camera']"
cheating quotes,"['cheating quotes', 'cheating quotes for her', 'cheating quotes tumblr', 'cheating quotes for him', 'cheating quotes funny', 'cheating quotes in spanish', 'cheating quotes images', 'cheating quotes twitter', 'cheating quotes for him images', 'cheating quotes pinterest']"
catch cheating spouse using cell phone,"['catch cheating spouse using cell phone', 'catch cheating spouse with cell phone', 'catch cheating spouse cell phone for free', 'catch cheating spouse cell phone software', 'catch cheating spouse cell phone free trial', 'catch cheating spouse cell phone spy', 'catch cheating husband cell phone', 'catch cheating wife cell phone']"
track spouse app,"['track spouse app', 'track my spouse app', 'track spouse visa application uk', 'track cheating spouse app', 'track spouse visa application', 'track spouse visa application pakistan', 'track spouse visa application australia', 'track spouse visa application canada', 'track australian spouse visa application', 'track your spouse visa application']"
cheat codes for gta 5 ps3,"['cheat codes for gta 5 ps3', 'cheat codes for gta 5 ps3 online', 'cheat codes for gta 5 ps3 tank', 'cheat codes for gta 5 ps3 ammo', 'cheat codes for gta 5 ps3 phone numbers', 'cheat codes for gta 5 ps3 numbers', 'cheat codes for gta 5 ps3 offline', 'cheat codes for gta 5 ps3 on phone', 'cheat codes for gta 5 ps3 for cars', 'cheat codes for gta 5 ps3 all guns']"
catch cheating spouse free,"['catch cheating spouse free', 'catch cheating spouse free app', 'catch cheating spouse software free', 'catch cheating spouse online free', 'catch cheating spouse text messages free', 'catch cheating spouse cell phone free', 'catch cheating spouse cell phone free trial', 'catch your spouse cheating free app', 'catch your spouse cheating online free']"
how to catch a cheating spouse through cell phone,"['how to catch a cheating spouse through cell phone', 'how to catch a cheating spouse using cell phone', 'how to catch a cheating spouse using cell phone for free', 'how to catch a cheating spouse cell phone', 'how to catch a cheating wife cell phone', 'how to catch a cheating spouse with his cell phone', 'how to catch a cheating husband on his cell phone']"
family tracker app reviews,"['family tracker app reviews', 'sprint family locator app reviews', 'family gps tracker app review']"
track girlfriend text messages,"['track girlfriend text messages', 'how to track your girlfriends text messages', 'how can i track my girlfriend text messages']"
family tracker free,"['family tracker free', 'family tracker free download', 'family locator free download', 'family locator free apk', 'family tree tracker free', 'family gps tracker free', 'family tracker apk free download', 'iphone family tracker free', 'family gps tracker free download', 'family phone tracker free']"
cheatcc pc,"['cheatcc pc', 'cheatcc pc witcher 3', 'cheatcc pc fallout 4', 'cheatcc pc skyrim', 'cheatcc pc sims 3', 'cheatcc pc gta 5', 'cheatcc pc gta san andreas', 'cheatcc pc sims 4', 'cheatcc pc fallout new vegas', 'fallout 3 cheats pc']"
family locator sprint,"['family locator sprint', 'family locator sprint iphone', 'family locator sprint plan', 'family locator sprint hack', 'family locator sprint login page', 'family locator sprint reviews', 'family tracking sprint', 'family locator app sprint', 'cancel family locator sprint', 'disable family locator sprint']"
how to track your girlfriends text messages,['how to track your girlfriends text messages for free']
sprint family locator blocker app,['sprint family locator blocker app']
free gps tracking app for iphone,"['free gps tracking app for iphone', 'free gps tracking app for iphone and android', 'free gps tracker app for iphone', 'free gps tracking software for iphone', 'best free gps tracking app for iphone', 'best free gps tracker app for iphone', 'best free gps phone tracking app for iphone', 'gps tracking app for iphone', 'gps tracking app for iphone 6', 'gps tracking app for iphone review']"
cheatcc gta 5 xbox one,['cheatcc gta 5 xbox one']
catch cheating spouse iphone,"['catch cheating spouse iphone', 'catch cheating spouse iphone app', 'catch cheating spouse iphone 5', 'catch your cheating spouse iphone', 'catch cheating spouse using iphone', 'catch cheating spouse with iphone 6', 'app to catch a cheating spouse iphone free', 'find my iphone catch cheating spouse']"
track girlfriend shirts,"['track girlfriend shirts', 'dirt track girlfriend shirts', 'cute track girlfriend shirts', 'track and field girlfriend shirts', 'dirt track racing girlfriend shirts']"
track girlfriends phone free,['track girlfriends phone free']
cheating quotes for him,"['cheating quotes for him', 'cheating quotes for him images', 'cheating quotes for him tumblr', 'cheating quotes for him in hindi', 'cheating quotes for him in telugu', 'cheating quotes for him in spanish', 'cheating quotes for him pinterest', 'cheating quotes for him in tamil', 'cheating husband quotes for him', 'cheating love quotes for him']"
fallout 3 cheats pc,"['fallout 3 cheats pc', 'fallout 3 cheats pc steam', 'fallout 3 cheats pc item codes', 'fallout 3 cheats pc instant-kill magnum', 'fallout 3 cheats pc weapons', 'fallout 3 cheats pc caps', 'fallout 3 cheats pc lockpick skill', 'fallout 3 cheats pc stimpacks', 'fallout 3 cheats pc infinite ammo', 'fallout 3 cheats pc perk codes']"
find my iphone catch cheating spouse,['find my iphone catch cheating spouse']
how to catch wife cheating with cell phone trace,['how to catch wife cheating with cell phone trace']
fallout 3 cheats pc weapons,"['fallout 3 cheats pc weapons', 'fallout 3 pc cheats weapon condition']"
fallout 3 cheats pc lockpick skill,['fallout 3 cheats pc lockpick skill']
read sms backup file on pc,"['read sms backup file on pc', 'how to read iphone sms backup file on pc']"
track my spouse app,"['track my spouse app', 'track my cheating spouse app', 'track my spouse visa application', 'track my wifes phone app', 'track my wifes phone app free']"
cheatcc gta 5 ps3,"['cheatcc gta 5 ps3', 'cheatcc gta 5 ps3 money', 'cheatcc gta 5 playstation 3']"
gps tracking app for iphone review,"['gps tracking app for iphone review', 'gps tracker for iphone reviews']"
read sms messages on pc,"['read sms messages on pc', 'read text messages on pc', 'read text messages on pc iphone', 'read android text messages on pc', 'read samsung text messages on pc', 'software to read text messages on pc', 'read windows phone text messages on pc', 'read sms on pc android', 'read sms on pc software', 'read text messages metropcs']"
cheat codes for gta 5 ps3 ammo,"['cheat codes for gta 5 ps3 ammo', 'cheat codes for gta 5 ps3 unlimited ammo', 'cheat codes for gta 5 ps3 more ammo']"
fallout 3 cheats pc stimpacks,['fallout 3 cheats pc stimpacks']
how to catch a cheating husband on his cell phone,"['how to catch a cheating husband on his cell phone', 'how to catch a cheating husband on cell phone']"
read text messages on pc iphone,"['read text messages on pc iphone', 'program to read iphone text messages on pc']"
cheating quotes pinterest,"['cheating quotes pinterest', 'cheating husband quotes pinterest', 'cheating boyfriend quotes pinterest', 'cheating quotes for him pinterest']"
catch cheating spouse app,"['catch cheating spouse app', 'catch cheating spouse app free', 'catch a cheating spouse app android', 'catch your cheating spouse app reviews', 'catch your spouse cheating app free', 'best app to catch cheating spouse iphone']"
track and field girlfriend shirts,['track and field girlfriend shirts']
family tracker free download,"['family tracker free download', 'family locator free download', 'family tracker apk free download', 'family gps tracker free download', 'family locator app free download', 'family locator apk free download', 'sprint family locator free download']"
fallout 3 cheats pc item codes,"['fallout 3 cheats pc item codes', 'fallout 3 cheats armor codes', 'fallout 3 cheat weapon codes']"
family locator sprint login page,"['family locator sprint login page', 'sprint family locator login page web enabled']"
read sms online free,"['read sms online free', 'read sms texts online free', 'read someones sms online free']"
family tracker apk free download,['family tracker apk free download']
cheating,"['cheating', 'cheating meme', 'cheating spouse', 'cheating songs', 'cheating husband', 'cheating stories', 'cheating definition', 'cheating quotes', 'cheating boyfriend', 'cheating website']"
catch cheating spouse with cell phone,"['catch cheating spouse with cell phone', 'catch cheating spouse cell phone for free', 'catch cheating spouse cell phone software', 'catch cheating spouse cell phone free trial', 'catch cheating spouse cell phone spy', 'catch cheating spouse using cell phone', 'catch cheating husband cell phone', 'catch cheating wife cell phone', 'how to catch wife cheating with cell phone trace', 'how to catch a cheating spouse with his cell phone']"
best free gps tracking app for iphone,"['best free gps tracking app for iphone', 'best free gps tracker app for iphone', 'best free gps phone tracking app for iphone', 'free gps tracking app for iphone', 'free gps tracking app for iphone and android', 'free gps tracker app for iphone', 'free gps tracking software for iphone', 'free gps locator app for iphone']"
samsung read sms on pc,"['samsung read sms on pc', 'samsung galaxy s3 read sms on pc', 'read samsung text messages on pc']"
read someones sms online free,"[""read someone's sms online free"", 'read someones text messages online free', 'read someone elses text messages online free']"
best free gps phone tracking app for iphone,['best free gps phone tracking app for iphone']
read texts online sprint,"['read texts online sprint', 'read my texts online sprint', 'can you read texts online sprint', 'access my texts online sprint', 'can parents read texts online sprint', 'how to read your texts online sprint', 'is it possible to read texts online sprint', 'is there a way to read texts online sprint', 'can your parents read your texts online sprint', 'can my dad read my texts online sprint']"
read sms messages,"['read sms messages', 'read sms messages android', 'read sms messages on pc', 'read sms messages on computer', 'read sms messages from another phone', 'read sms messages remotely', 'read sms messages on icloud', 'read sms messages on ipad', 'read sms messages on mac', 'read sms messages from iphone backup']"
catch your cheating spouse app reviews,['catch your cheating spouse app reviews']
cheat codes for gta 5 ps3 numbers,['cheat codes for gta 5 ps3 numbers']
track spouse visa application canada,['track spouse visa application canada']
family locator app for iphone,"['family locator app for iphone', 'family locator app for iphone and android', 'family tracking app for iphone', 'family tracking app for iphone and android', 'best family locator app for iphone', 'sprint family locator app for iphone', 'verizon family locator app for iphone', 'sprint family locator app for iphone 5', 'free family locator app for iphone', 'best family locator app for iphone 2015']"
catch cheating spouse android phone,['catch cheating spouse android phone']
family tracker verizon,"['family tracker verizon', 'family locator verizon wireless login', 'family locator verizon how does it work', 'family locator verizon app', 'family locator verizon review', 'family locator verizon login', 'family locator verizon prepaid']"
cheatcc gta 5 playstation 3,['cheatcc gta 5 playstation 3']
cheat engine 6.4,"['cheat engine 6.4', 'cheat engine 6.4 mac', 'cheat engine 6.4 no admin', 'cheat engine 6.4 roblox', 'cheat engine 6.4 apk', 'cheat engine 6.4 windows 10', 'cheat engine 6.4 borderlands 2', 'cheat engine 6.4 portable', 'cheat engine 6.4 32 bit', 'cheat engine 6.4 for android no root']"
family tracker app,"['family tracker app', 'family tracker app free', 'family tracker app reviews', 'family tracker app for iphone', 'family tracker app for android', 'family tracker app for iphone and android', 'family tracker app at&t', 'family tracker app for android and ios devices', 'family tracker app ios', 'family tracker app android source code']"
catch your spouse cheating online free,['catch your spouse cheating online free']
read someone elses text messages online free,['read someone elses text messages online free']
fallout 3 cheat weapon codes,"['fallout 3 cheat weapon codes', 'fallout 3 cheat item codes', 'fallout 3 weapon cheat codes xbox 360', 'fallout 3 cheat code item list']"
cheating quotes for him pinterest,['cheating quotes for him pinterest']
cheatcc pc witcher 3,['cheatcc pc witcher 3']
cheating boyfriend,"['cheating boyfriend', 'cheating boyfriend meme', 'cheating boyfriend quotes', 'cheating boyfriend songs', 'cheating boyfriend test', 'cheating boyfriend dream', 'cheating boyfriend prank', 'cheating boyfriend caught', 'cheating boyfriend games', 'cheating boyfriend stories']"
track my wifes phone app,"['track my wifes phone app', 'track my wifes phone app free']"
family locator verizon review,"['family locator verizon reviews', 'verizon wireless family locator review']"
best family locator app for iphone 2015,"['best family locator app for iphone 2015', 'best family locator app for android and iphone 2015']"
cheating spouse,"['cheating spouse', 'cheating spouse meme', 'cheating spouse caught', 'cheating spouse app', 'cheating spouse dream', 'cheating spouse forums', 'cheating spouse revenge reddit', 'cheating spouse investigator', 'cheating spouse quotes', 'cheating spouse tracker']"
read sms messages on ipad,"['read sms messages on ipad', 'read text messages on ipad', 'read iphone text messages on ipad', 'can you read text messages on ipad', 'app to read text messages on ipad', 'read sms on ipad 3g']"
keylogger,"['keylogger', 'keylogger software', 'keylogger detector', 'keylogger for mac', 'keylogger for iphone', 'keylogger android', 'keylogger usb', 'keylogger definition', 'keylogger virus', 'keylogger for windows 10']"
family locator app free download,"['family locator app free download', 'life360 family locator app free download']"
catch cheating spouse app iphone,"['catch cheating spouse app iphone', 'app to catch a cheating spouse iphone free']"
how to catch a cheating spouse using cell phone,"['how to catch a cheating spouse using cell phone for free', 'how to catch a cheating spouse using cell phone', 'how to catch a cheating spouse with his cell phone', 'how to catch a cheating spouse with their cell phone', 'how to catch a cheating spouse through cell phone', 'how to catch wife cheating with cell phone trace', 'how to catch a cheating wife cell phone', 'how to catch a cheating husband on his cell phone']"
spyro,"['spyro', 'spyro the dragon', 'spyro ps4', 'spyro gyra', 'spyro year of the dragon', 'spyro the dragon ps4', 'spyro remake', 'spyro dawn of the dragon', 'spyro ps1', 'spyro enter the dragonfly']"
family gps tracker free,"['family gps tracker free', 'family gps tracker free download', 'free family gps tracker app']"
catch cheating spouse cell phone free trial,['catch cheating spouse cell phone free trial']
family tracker app at&t,"['family tracker app at&t', 'family locator app at&t']"
best family tracker app for iphone and android,"['best family tracker app for iphone and android', 'best family locator app for iphone and android', 'family tracker app for iphone and android', 'family locator app for iphone and android', 'best family locator app for android and iphone 2015']"
read sms on ipad 3g,['read sms on ipad 3g']
fallout 3 cheats pc perk codes,"['fallout 3 cheats pc perk codes', 'fallout 3 cheats pc item codes', 'fallout 3 cheats pc skill points']"
cheating quotes for him in spanish,['cheating quotes for him in spanish']
is there a way to read texts online sprint,['is there a way to read texts online sprint']
cheat codes,"['cheat codes', 'cheat codes for gta 5', 'cheat codes for gta 5 ps3', 'cheat codes for gta v', 'cheat codes no promises', 'cheat codes band', 'cheat codes for sims 4', 'cheat codes for gta 4', 'cheat codes for skate 3', 'cheat codes ps4']"
cheatcc ps2,"['cheatcc ps2', 'cheatcc ps2 san andreas', 'cheatcc ps2 gta 3', 'cheatcc ps2 vice city', 'cheatcc ps2 cheats', 'cheatcc ps2 guitar hero 3', 'cheatcc ps2 guitar hero 2', 'cheatcc ps2 battlefront 2', 'cheatcc ps2 the warriors', 'cheatcc ps2 sims bustin out']"
cheat codes band,"['cheat codes band', 'cheat codes band tour', 'cheat codes band names', 'cheat codes band lead singer', 'cheat codes band merch', 'cheat codes band no promises', 'cheat codes band members ages', 'cheat codes band members names']"
read someones text messages online free,"['read someones text messages online free', 'read someone elses text messages online free', 'how do you read someones text messages online free', 'read someones sms online free']"
cheat engine 6.4 roblox,"['cheat engine 6.4 roblox', 'cheat engine 6.4 roblox hacks', 'cheat engine 6.4 roblox download', 'cheat engine 6.4 roblox robux', 'cheat engine 6.4 roblox bypass', 'cheat engine 6.4 roblox 2015', 'cheat engine 6.4 roblox robux hack', 'cheat engine 6.4 roblox noclip', 'cheat engine 6.4 roblox windows 8', 'cheat engine 6.4 roblox twisted murderer']"
cheating quotes for her,"['cheating quotes for her', 'cheating quotes for her in hindi', 'cheating quotes for her tumblr', 'cheating quotes for her tagalog', 'cheating love quotes for her', 'funny cheating quotes for her', 'cheating girlfriend quotes for her', ""i'm sorry for cheating quotes for her"", 'love quotes for her after cheating']"
catch your spouse cheating app free,['catch your spouse cheating app free']
track spouse visa application pakistan,['track spouse visa application pakistan']
read my texts online sprint,"['read my texts online sprint', 'access my texts online sprint', 'read my text messages online sprint', 'can my parents read my texts online sprint', 'can my dad read my texts online sprint']"
cheating quotes for her tagalog,['cheating quotes for her tagalog']
cheating quotes for him in hindi,['cheating quotes for him in hindi']
cheat codes for gta 5 ps3 on phone,['cheat codes for gta 5 ps3 on phone']
cheat engine 6.4 mac,"['cheat engine 6.4 mac', 'cheat engine 6.4 mac os x', 'cheat engine 6.4 mac os', 'cheat engine 6.4 for macbook pro', 'download cheat engine 6.4 for macbook', 'how to get cheat engine 6.4 on mac', 'how to use cheat engine 6.4 on mac', 'cheat engine 6.4 para mac', 'cheat engine 6.4 per mac', 'descargar cheat engine 6.4 mac']"
read text messages metropcs,"['read text messages metro pcs', 'how to check text messages metro pcs', 'read deleted text messages metropcs', 'can parents read text messages metropcs']"
cheat engine 6.4 mac os,"['cheat engine 6.4 mac os x', 'cheat engine 6.4 mac os']"
program to read iphone text messages on pc,['program to read iphone text messages on pc']
